{
  "created_at": "2026-08-18T00:00:00Z",
  "created_by": "service-account:model-feedback-exporter",
  "dataset_id": "portrait.hard-samples",
  "items": [
    {
      "authorized_for_training": true,
      "correction": {
        "bbox": [
          1,
          2,
          30,
          40
        ],
        "label": "person"
      },
      "deidentified": true,
      "feedback_id": "fbk_contractexample",
      "kind": "false_negative",
      "media_ref": "objects/media/example",
      "model_id": "scenara.portrait.person-detector",
      "model_version": "1.0.0",
      "pipeline_id": "portrait.person-detection",
      "pipeline_version": "0.1.0",
      "result_ref": "objects/results/example.json"
    }
  ],
  "label_schema": "scenara.feedback.correction.v1",
  "manifest_id": "hsm_contractexample",
  "project_id": "project-example",
  "schema_version": "1.0",
  "sha256": "5273bac3a17ceb3e192311fbad6c05afe7c371a33cc8549390ea478b0e13c079",
  "split": "train",
  "tenant_id": "tenant-example",
  "version": "1.0.0"
}
